{
  "title": "Validation & Cleansing Pipeline v3",
  "description": "This pipeline validates raw input data and cleanses it to produce a final output.",
  "variables": [
    {
      "id": "raw-data-var",
      "title": "Initial Raw Input",
      "datasetUuid": "DATASET_UUID"
    },
    {
      "id": "validated-data-var",
      "title": "Intermediate Validated Data"
    },
    {
      "id": "cleansed-output-var",
      "title": "Final Cleansed Output Var"
    }
  ],
  "steps": [
    {
      "id": "validate-step",
      "title": "Validate Raw",
      "pluginUuid": "PLUGIN_UUID",
      "inputs": [
        "raw-data-var"
      ],
      "outputs": [
        "validated-data-var"
      ]
    },
    {
      "id": "cleanse-step",
      "title": "Cleanse Data",
      "pluginUuid": "PLUGIN_UUID",
      "inputs": [
        "validated-data-var"
      ],
      "outputs": [
        "cleansed-output-var"
      ],
      "precededBy": [
        "validate-step"
      ]
    }
  ]
}